<?xml version="1.0" encoding="UTF-8"?>


<rezeptsammlung
xmlns:xsi="http://www.w3.org/2001/XMLSchema-instance"
xsi:noNamespaceSchemaLocation="aufgabe3.xsd">
<rezept>
	<name>Lenchen’s Schokoladenkuchen</name>
	<zutaten>
		<anzahl_personen>16</anzahl_personen>
		<zutat menge="200" einheit="g">
			<name>Butter</name>
		</zutat>
		<zutat menge="200" einheit="g">
			<name>Zucker</name>
		</zutat>
		<zutat menge="200" einheit="g">
			<name>Schokolade, Blockschokolade</name>
		</zutat>
		<zutat menge="120" einheit="g">
			<name>Mehl</name>
		</zutat>
		<zutat menge="0.5" einheit="Teeloeffel">
			<name>Backpulver</name>
		</zutat>
		<zutat menge="1" einheit="Paket">
			<name>Vanillezucker</name>
		</zutat>
		<zutat menge="4" einheit="Stueck">
			<name>Ei</name>
		</zutat>
	</zutaten>
	<zubereitung>
	  <arbeitszeit menge="1" einheit="Stunde"/>
	  <schwierigkeitsgrad>normal</schwierigkeitsgrad>
	  <brennwert menge="295" einheit="kcal"/>
	<anleitung>
	<schritt nummer="1">
		<inhalt>Butter und Schokolade im Wasserbad schmelzen.</inhalt>
	</schritt>
	<schritt nummer="2">
		<inhalt>Eier trennen.</inhalt>
	</schritt>
	<schritt nummer="3">
		<inhalt>Eiweiß steif schlagen.</inhalt>
	</schritt>
	<schritt nummer="4">
		<inhalt>Eigelbe, Zucker und Vanillezucker verrühren.</inhalt>
	</schritt>
	<schritt nummer="5">
		<inhalt>Geschmolzene Butter-Schokomasse hinzufügen und mischen.</inhalt>
	</schritt>
	<schritt nummer="6">
		<inhalt>Mehl mit dem Backpulver in die Masse sieben und zum Schluss die steifen Eiweiße vorsichtig unterheben.</inhalt>
	</schritt>
	<schritt nummer="7">
		<inhalt>In eine gut gefettete Form geben.</inhalt>
	</schritt>
	<schritt nummer="8">
		<inhalt>Bei 180°Grad 40 – 50 Minuten backen. 
			<!-- <backvorgang>
				<temperatur>
					<menge>180</menge>
					<einheit>°C</einheit>
				</temperatur>
				<dauer>
					<mindestens>
						<menge>40</menge>
					</mindestens>
					<hoechstens>
						<menge>50</menge>
					</hoechstens>
				<einheit>minuten</einheit>
				</dauer>
			</backvorgang> -->
		</inhalt>
	</schritt> 
	</anleitung>
	</zubereitung>
	<!-- REPRÄSENTATIV 1 BILD & 1 KOMMENTAR -->
	<bilder>
	  <bild>
	    <bildbesitzer>Mutschkabras</<bildbesitzer>
	    <nummer>20</nummer>
	    <url>http://static.chefkoch-cdn.de/ck.de/rezepte/2/2464/42942-960x720-lenchen-s-schokoladenkuchen.jpg</url>
	  </bild>
	</bilder>
	<kommentare>
	  <kommentar>
	    <inhalt>Habe Deinen Kuchen gestern gebacken (kleine Abwandlung: statt Blockschokolade hatte ich nur Kuvertüre, zartbitter und ich habe noch etwas Rumaroma und eine Prise Salz dazugegeben) mein LAG war total begeistert. Ich übrigends auch, super Rezept.</inhalt>
	    <quelle>
	      <name>swieselchen</name>
	      <avatar>http://static.chefkoch-cdn.de/ck.de/avatar/5ab77fec95e69919037a2ea283c4d6a6-60fix.jpg</avatar>
	      <datum>2002-02-07T18:49:00</datum>
	    </quelle>
	  </kommentar>
	</kommentare> 
</rezept>
</rezeptsammlung>